{
  "$schema": "../config/data.schema.json",
  "date": "2026-06-28",
  "intro": {
    "id": "intro",
    "topTitle": "Intro",
    "bottomTitle": "Intro",
    "contentTitle": "今日概览",
    "tabs": [
      {"id": "i1", "title": "A", "summary": "摘要一。", "icon": "icons/test-icon-sample-1.svg"},
      {"id": "i2", "title": "B", "summary": "摘要二。", "icon": "icons/test-icon-sample-2.svg"}
    ],
    "scenes": [{"id": "intro-greeting", "subtitle": "开场口播文案足够长的一句话。"}]
  },
  "stories": [
    {
      "id": "story-1",
      "topTitle": "模型产品",
      "bottomTitle": "GLM",
      "contentTitle": "GLM 模型更新",
      "tabs": [
        {"id": "tab-1", "title": "事件概览", "summary": "摘要三。", "icon": "icons/test-icon-sample-1.svg"},
        {"id": "tab-2", "title": "用户影响", "summary": "摘要四。", "icon": "icons/test-icon-sample-2.svg"}
      ],
      "scenes": [{"id": "scene-1", "subtitle": "一句足够长的旁白口播文案。"}]
    }
  ],
  "outro": {
    "id": "outro",
    "topTitle": "结语",
    "bottomTitle": "再见",
    "scenes": [{"id": "outro-ending", "subtitle": "今天的资讯播送完了，明天见！"}]
  }
}
